Mose	Mos	1	30	35	 Da sprach sie zu ihrem Vater: Mein Herr, zürne mir nicht, denn ich kann nicht aufstehen vor dir, denn es geht mir nach der Frauen Weise. Also fand er die Götzen nicht, wie sehr er suchte.
Mose	Mos	1	30	36	 Und Jakob ward zornig und schalt Laban und sprach zu ihm: Was habe ich mißgehandelt oder gesündigt, daß du so auf mich erhitzt bist?
Mose	Mos	1	30	37	 Du hast allen meinen Hausrat betastet. Was hast du von meinem Hausrat gefunden? Lege das dar vor meinen und deinen Brüdern, daß sie zwischen uns beiden richten.
Mose	Mos	1	30	38	 Diese zwanzig Jahre bin ich bei dir gewesen, deine Schafe und Ziegen sind nicht unfruchtbar gewesen; die Widder deiner Herde habe ich nie gegessen;
Mose	Mos	1	30	39	 was die Tiere zerrissen, brachte ich dir nicht, ich mußte es bezahlen; du fordertest es von meiner Hand, es mochte mir des Tages oder des Nachts gestohlen sein.
Mose	Mos	1	30	40	 Des Tages verschmachtete ich vor Hitze und des Nachts vor Frost, und kam kein Schlaf in meine Augen.
Mose	Mos	1	30	41	 Also habe ich diese zwanzig Jahre in deinem Hause gedient, vierzehn um deine Töchter und sechs um deine Herde, und du hast mir meinen Lohn zehnmal verändert.
Mose	Mos	1	30	42	 Wo nicht der Gott meines Vaters, der Gott Abrahams und die Furcht Isaaks, auf meiner Seite gewesen wäre, du hättest mich leer lassen ziehen. Aber Gott hat mein Elend und meine Mühe angesehen und hat dich gestern gestraft.
Mose	Mos	1	30	43	 Laban antwortete und sprach zu Jakob: Die Töchter sind meine Töchter, und die Kinder sind meine Kinder, und die Herden sind meine Herden, und alles, was du siehst, ist mein. Was kann ich meinen Töchtern heute oder ihren Kindern tun, die sie geboren haben?
Mose	Mos	1	30	44	 So komm nun und laß uns einen Bund machen, ich und du, der ein Zeugnis sei zwischen mir und dir.
Mose	Mos	1	30	45	 Da nahm Jakob einen Stein und richtete ihn auf zu einem Mal.
Mose	Mos	1	30	46	 und sprach zu seinen Brüdern: Leset Steine auf! Und sie nahmen Steine und machten einen Haufen und aßen auf dem Haufen.
Mose	Mos	1	30	47	 Und Laban hieß ihn Jegar-Sahadutha; Jakob aber hieß ihn Gilead.
Mose	Mos	1	30	48	 Da sprach Laban: Der Haufe sei heute Zeuge zwischen mir und dir (daher heißt man ihn Gilead)
Mose	Mos	1	30	49	 und sei eine Warte; denn er sprach: Der HERR sehe darein zwischen mir und dir, wenn wir voneinander kommen,
Mose	Mos	1	30	50	 wo du meine Töchter bedrückst oder andere Weiber dazunimmst über meine Töchter. Es ist kein Mensch hier mit uns; siehe aber, Gott ist der Zeuge zwischen mir und dir.
Mose	Mos	1	30	51	 Und Laban sprach weiter zu Jakob: Siehe, das ist der Haufe, und das ist das Mal, das ich aufgerichtet habe zwischen mir und dir.
Mose	Mos	1	30	52	 Derselbe Haufe sei Zeuge, und das Mal sei auch Zeuge, wenn ich herüberfahre zu dir oder du herüberfährst zu mir über diesen Haufen und dies Mal, zu beschädigen.
Mose	Mos	1	30	53	 Der Gott Abrahams und der Gott Nahors, der Gott ihres Vaters sei Richter zwischen uns.
Mose	Mos	1	30	54	 Und Jakob schwur ihm bei der Furcht seines Vaters Isaak. Und Jakob opferte auf dem Berge und lud seine Brüder zum Essen. Und da sie gegessen hatten, blieben sie auf dem Berge über Nacht.
Mose	Mos	1	30	55	 Des Morgens aber stand Laban früh auf, küßte seine Kinder und Töchter und segnete sie und zog hin und kam wieder an seinen Ort.
Mose	Mos	1	31	1 	 Jakob aber zog seinen Weg; und es begegneten ihm die Engel Gottes.
Mose	Mos	1	31	2	 Und da er sie sah, sprach er: Es sind Gottes Heere; und hieß die Stätte Mahanaim.
Mose	Mos	1	31	3	 Jakob aber schickte Boten vor sich her zu seinem Bruder Esau ins Land Seir, in die Gegend Edoms,
Mose	Mos	1	31	4	 und befahl ihnen und sprach: Also sagt meinem Herrn Esau: Dein Knecht Jakob läßt dir sagen: Ich bin bis daher bei Laban lange außen gewesen
Mose	Mos	1	31	5	 und habe Rinder und Esel, Schafe, Knechte und Mägde; und habe ausgesandt, dir, meinem Herrn, anzusagen, daß ich Gnade vor deinen Augen fände.
Mose	Mos	1	31	6	 Die Boten kamen wieder zu Jakob und sprachen: Wir kamen zu deinem Bruder Esau; und er zieht dir auch entgegen mit vierhundert Mann.
Mose	Mos	1	31	7	 Da fürchtete sich Jakob sehr, und ihm ward bange; und teilte das Volk, das bei ihm war, und die Schafe und die Rinder und die Kamele in zwei Heere
Mose	Mos	1	31	8	 und sprach: So Esau kommt auf das eine Heer und schlägt es, so wird das übrige entrinnen.
Mose	Mos	1	31	9	 Weiter sprach Jakob: Gott meines Vaters Abraham und Gott meines Vaters Isaak, HERR, der du zu mir gesagt hast: Zieh wieder in dein Land und zu deiner Freundschaft, ich will dir wohltun!
Mose	Mos	1	31	10	 ich bin zu gering aller Barmherzigkeit und aller Treue, die du an deinem Knechte getan hast; denn ich hatte nicht mehr als diesen Stab, da ich über den Jordan ging, und nun bin ich zwei Heere geworden.
Mose	Mos	1	31	11	 Errette mich von der Hand meines Bruders, von der Hand Esaus; denn ich fürchte mich vor ihm, daß er nicht komme und schlage mich, die Mütter samt den Kindern.
Mose	Mos	1	31	12	 Du hast gesagt ich will dir wohltun und deinen Samen machen wie den Sand am Meer, den man nicht zählen kann vor der Menge.
Mose	Mos	1	31	13	 Und er blieb die Nacht da und nahm von dem, das er vor Handen hatte, ein Geschenk für seinen Bruder Esau:
Mose	Mos	1	31	14	 zweihundert Ziegen, zwanzig Böcke, zweihundert Schafe, zwanzig Widder
Mose	Mos	1	31	15	 und dreißig säugende Kamele mit ihren Füllen, vierzig Kühe und zehn Farren, zwanzig Eselinnen mit zehn Füllen,
Mose	Mos	1	31	16	 und tat sie unter die Hand seiner Knechte, je eine Herde besonders, und sprach zu ihnen: Gehet vor mir hin und lasset Raum zwischen einer Herde nach der andern;
Mose	Mos	1	31	17	 und gebot dem ersten und sprach: Wenn dir mein Bruder Esau begegnet und dich fragt: Wem gehörst du an, und wo willst du hin, und wes ist's, was du vor dir treibst?
Mose	Mos	1	31	18	 sollst du sagen: Es gehört deinem Knechte Jakob zu, der sendet Geschenk seinem Herrn Esau und zieht hinter uns her.
Mose	Mos	1	31	19	 Also gebot er auch dem andern und dem dritten und allen, die den Herden nachgingen, und sprach: Wie ich euch gesagt habe, so sagt zu Esau, wenn ihr ihm begegnet;
Mose	Mos	1	31	20	 und sagt ja auch: Siehe, dein Knecht Jakob ist hinter uns. Denn er gedachte: Ich will ihn versöhnen mit dem Geschenk, das vor mir her geht; darnach will ich ihn sehen, vielleicht wird er mich annehmen.
Mose	Mos	1	31	21	 Also ging das Geschenk vor ihm her, aber er blieb dieselbe Nacht beim Heer
Mose	Mos	1	31	22	 und stand auf in der Nacht und nahm seine zwei Weiber und die zwei Mägde und seine elf Kinder und zog an die Furt des Jabbok,
Mose	Mos	1	31	23	 nahm sie und führte sie über das Wasser, daß hinüberkam, was er hatte,
Mose	Mos	1	31	24	 und blieb allein. Da rang ein Mann mit ihm, bis die Morgenröte anbrach.
Mose	Mos	1	31	25	 Und da er sah, daß er ihn nicht übermochte, rührte er das Gelenk seiner Hüfte an; und das Gelenk der Hüfte Jakobs ward über dem Ringen mit ihm verrenkt.
Mose	Mos	1	31	26	 Und er sprach: Laß mich gehen, denn die Morgenröte bricht an. Aber er antwortete: Ich lasse dich nicht, du segnest mich denn.
Mose	Mos	1	31	27	 Er sprach: Wie heißt du? Er antwortete: Jakob.
Mose	Mos	1	31	28	 Er sprach: Du sollst nicht mehr Jakob heißen, sondern Israel; denn du hast mit Gott und mit Menschen gekämpft und bist obgelegen.
Mose	Mos	1	31	29	 Und Jakob fragte ihn und sprach: Sage doch, wie heißt du? Er aber sprach: Warum fragst du, wie ich heiße? Und er segnete ihn daselbst.
Mose	Mos	1	31	30	 Und Jakob hieß die Stätte Pniel; denn ich habe Gott von Angesicht gesehen, und meine Seele ist genesen.
Mose	Mos	1	31	31	 Und als er an Pniel vorüberkam, ging ihm die Sonne auf; und er hinkte an seiner Hüfte.
Mose	Mos	1	31	32	 Daher essen die Kinder Israel keine Spannader auf dem Gelenk der Hüfte bis auf den heutigen Tag, darum daß die Spannader an dem Gelenk der Hüfte Jakobs angerührt ward.
Mose	Mos	1	32	1 	 Jakob hob seine Augen auf und sah seinen Bruder Esau kommen mit vierhundert Mann. Und er teilte seine Kinder zu Lea und Rahel und zu den beiden Mägden
Mose	Mos	1	32	2	 und stellte die Mägde mit ihren Kindern vornean und Lea mit ihren Kindern hernach und Rahel mit Joseph zuletzt.
Mose	Mos	1	32	3	 Und er ging vor ihnen her und neigte sich siebenmal auf die Erde, bis er zu seinem Bruder kam.
Mose	Mos	1	32	4	 Esau aber lief ihm entgegen und herzte ihn und fiel ihm um den Hals und küßte ihn; und sie weinten.
Mose	Mos	1	32	5	 Und er hob seine Augen auf und sah die Weiber mit den Kindern und sprach: Wer sind diese bei dir? Er antwortete: Es sind Kinder, die Gott deinem Knecht beschert hat.
Mose	Mos	1	32	6	 Und die Mägde traten herzu mit ihren Kindern und neigten sich vor ihm.
Mose	Mos	1	32	7	 Lea trat auch herzu mit ihren Kindern und neigten sich vor ihm. Darnach trat Joseph und Rahel herzu und neigten sich auch vor ihm.
Mose	Mos	1	32	8	 Und er sprach: Was willst du mit all dem Heere, dem ich begegnet bin? Er antwortete: Daß ich Gnade fände vor meinem Herrn.
Mose	Mos	1	32	9	 Esau sprach: Ich habe genug, mein Bruder; behalte was du hast.
Mose	Mos	1	32	10	 Jakob antwortete: Ach, nicht! Habe ich Gnade gefunden vor dir, so nimm mein Geschenk von meiner Hand; denn ich sah dein Angesicht, als sähe ich Gottes Angesicht; und laß dir's wohl gefallen von mir.
Mose	Mos	1	32	11	 Nimm doch den Segen von mir an, den ich dir zugebracht habe; denn Gott hat mir's beschert, und ich habe alles genug. Also nötigte er ihn, daß er's nahm.
Mose	Mos	1	32	12	 Und er sprach: Laß uns fortziehen und reisen, ich will mit dir ziehen.
Mose	Mos	1	32	13	 Er aber sprach zu ihm: Mein Herr, du erkennest, daß ich zarte Kinder bei mir habe, dazu säugende Schafe und Kühe; wenn sie einen Tag übertrieben würden, würde mir die ganze Herde sterben.
Mose	Mos	1	32	14	 Mein Herr ziehe vor seinem Knechte hin. Ich will gemächlich hintennach treiben, nach dem das Vieh und die Kinder gehen können, bis daß ich komme zu meinem Herrn nach Seir.
Mose	Mos	1	32	15	 Esau sprach: So will ich doch etliche bei dir lassen vom Volk, das mit mir ist. Er antwortete: Was ist's vonnöten? Laß mich nur Gnade vor meinem Herrn finden.
Mose	Mos	1	32	16	 Also zog des Tages Esau wiederum seines Weges gen Seir.
Mose	Mos	1	32	17	 Und Jakob zog gen Sukkoth und baute sich ein Haus und machte seinem Vieh Hütten; daher heißt die Stätte Sukkoth.
Mose	Mos	1	32	18	 Darnach zog Jakob mit Frieden zu der Stadt Sichems, die im Lande Kanaan liegt (nachdem er aus Mesopotamien gekommen war), und machte sein Lager vor der Stadt
Mose	Mos	1	32	19	 und kaufte ein Stück Acker von den Kindern Hemors, des Vaters Sichems, um hundert Groschen; daselbst richtete er seine Hütte auf.
Mose	Mos	1	32	20	 Und er richtete daselbst einen Altar zu und rief an den Namen des starken Gottes Israels.
Mose	Mos	1	33	1 	 Dina aber, Leas Tochter, die sie Jakob geboren hatte, ging heraus, die Töchter des Landes zu sehen.
Mose	Mos	1	33	2	 Da die sah Sichem, Hemors Sohn, des Heviters, der des Landes Herr war, nahm er sie und lag bei ihr und schwächte sie.
Mose	Mos	1	33	3	 Und sein Herz hing an ihr, und er hatte die Dirne lieb und redete freundlich mit ihr.
Mose	Mos	1	33	4	 Und Sichem sprach zu seinem Vater Hemor: Nimm mir das Mägdlein zum Weibe.
Mose	Mos	1	33	5	 Und Jakob erfuhr, daß seine Tochter Dina geschändet war; und seine Söhne waren mit dem Vieh auf dem Felde, und Jakob schwieg bis daß sie kamen.
Mose	Mos	1	33	6	 Da ging Hemor, Sichems Vater, heraus zu Jakob, mit ihm zu reden.
Mose	Mos	1	33	7	 Indes kamen die Söhne Jakobs vom Felde. Und da sie es hörten, verdroß es die Männer, und sie wurden sehr zornig, daß er eine Torheit an Israel begangen und bei Jakobs Tochter gelegen hatte, denn so sollte es nicht sein.
Mose	Mos	1	33	8	 Da redete Hemor mit ihnen und sprach: Meines Sohnes Sichem Herz sehnt sich nach eurer Tochter; gebt sie ihm doch zum Weibe.
Mose	Mos	1	33	9	 Befreundet euch mit uns; gebt uns eure Töchter und nehmt ihr unsere Töchter
Mose	Mos	1	33	10	 und wohnt bei uns. Das Land soll euch offen sein; wohnt und werbet und gewinnet darin.
Mose	Mos	1	33	11	 Und Sichem sprach zu ihrem Vater und ihren Brüdern: Laßt uns Gnade bei euch finden; was ihr mir sagt, das will ich euch geben.
Mose	Mos	1	33	12	 Fordert nur getrost von mir Morgengabe und Geschenk, ich will's geben, wie ihr heischt; gebt mir nur die Dirne zum Weibe.
Mose	Mos	1	33	13	 Da antworteten Jakobs Söhne dem Sichem und seinem Vater Hemor betrüglich, darum daß ihre Schwester Dina geschändet war,
Mose	Mos	1	33	14	 und sprachen zu ihnen: Wir können das nicht tun, daß wir unsere Schwester einem unbeschnittenem Mann geben; denn das wäre uns eine Schande.
Mose	Mos	1	33	15	 Doch dann wollen wir euch zu Willen sein, so ihr uns gleich werdet und alles, was männlich unter euch ist, beschnitten werde;
Mose	Mos	1	33	16	 dann wollen wir unsere Töchter euch geben und eure Töchter uns nehmen und bei euch wohnen und ein Volk sein.
Mose	Mos	1	33	17	 Wo ihr aber nicht darein willigen wollt, euch zu beschneiden, so wollen wir unsere Tochter nehmen und davonziehen.
Mose	Mos	1	33	18	 Die Rede gefiel Hemor und seinem Sohn wohl.
Mose	Mos	1	33	19	 Und der Jüngling verzog nicht, solches zu tun; denn er hatte Lust zu der Tochter Jakobs. Und er war herrlich gehalten über alle in seines Vaters Hause.
Mose	Mos	1	33	20	 Da kamen sie nun, Hemor und sein Sohn Sichem, unter der Stadt Tor und redeten mit den Bürgern der Stadt und sprachen:
Mose	Mos	1	33	21	 Diese Leute sind friedsam bei uns und wollen im Lande wohnen und werben; so ist nun das Land weit genug für sie. Wir wollen uns ihre Töchter zu Weibern nehmen und ihnen unser Töchter geben.
Mose	Mos	1	33	22	 Aber dann wollen sie uns zu Willen sein, daß sie bei uns wohnen und ein Volk mit uns werden, wo wir alles, was männlich unter uns ist, beschneiden, gleich wie sie beschnitten sind.
Mose	Mos	1	33	23	 Ihr Vieh und ihre Güter und alles, was sie haben, wird unser sein, so wir nur ihnen zu Willen werden, daß sie bei uns wohnen.
Mose	Mos	1	33	24	 Und sie gehorchten dem Hemor und Sichem, seinem Sohn, alle, die zu seiner Stadt Tor aus und ein gingen, und beschnitten alles, was männlich war, das zu dieser Stadt aus und ein ging.
Mose	Mos	1	33	25	 Und am dritten Tage, da sie Schmerzen hatten, nahmen die zwei Söhne Jakobs, Simeon und Levi, der Dina Brüder, ein jeglicher sein Schwert und gingen kühn in die Stadt und erwürgten alles, was männlich war.
Mose	Mos	1	33	26	 und erwürgten auch Hemor und seinen Sohn Sichem mit der Schärfe des Schwerts und nahmen ihre Schwester Dina aus dem Hause Sichems und gingen davon.
Mose	Mos	1	33	27	 Da kamen die Söhne Jakobs über die erschlagenen und plünderten die Stadt, darum daß sie hatten ihre Schwester geschändet.
Mose	Mos	1	33	28	 Und nahmen ihre Schafe, Rinder, Esel und was in der Stadt und auf dem Felde war
Mose	Mos	1	33	29	 und alle ihre Habe; alle Kinder und Weiber nahmen sie gefangen, und plünderten alles, was in den Häusern war.
Mose	Mos	1	33	30	 Und Jakob sprach zu Simeon und Levi: Ihr habt mir Unglück zugerichtet und mich stinkend gemacht vor den Einwohnern dieses Landes, den Kanaanitern und Pheresitern; und ich bin ein geringer Haufe. Wenn sie sich nun versammeln über mich, so werden sie mich schlagen. Also werde ich vertilgt samt meinem Hause.
Mose	Mos	1	33	31	 Sie antworteten aber: Sollten sie denn mit unsrer Schwester wie mit einer Hure handeln?
Mose	Mos	1	34	1 	 Und Gott sprach zu Jakob: Mache dich auf und ziehe gen Beth-El und wohne daselbst und mache daselbst einen Altar dem Gott, der dir erschien, da du flohest vor deinem Bruder Esau.
Mose	Mos	1	34	2	 Da sprach Jakob zu seinem Hause und zu allen, die mit ihm waren: Tut von euch fremde Götter, so unter euch sind, und reinigt euch und ändert eure Kleider
Mose	Mos	1	34	3	 und laßt uns auf sein und gen Beth-El ziehen, daß ich daselbst einen Altar mache dem Gott, der mich erhört hat zur Zeit meiner Trübsal und ist mit mir gewesen auf dem Wege, den ich gezogen bin.
Mose	Mos	1	34	4	 Da gaben sie ihm alle fremden Götter, die unter ihren Händen waren, und ihre Ohrenspangen; und er vergrub sie unter einer Eiche, die neben Sichem stand.
Mose	Mos	1	34	5	 Und sie zogen aus. Und es kam die Furcht Gottes über die Städte, die um sie her lagen, daß sie den Söhnen Jakobs nicht nachjagten.
Mose	Mos	1	34	6	 Also kam Jakob gen Lus im Lande Kanaan, das da Beth-El heißt, samt all dem Volk, das mit ihm war,
Mose	Mos	1	34	7	 und baute daselbst einen Altar und hieß die Stätte El-Beth-El, darum daß ihm daselbst Gott offenbart war, da er floh vor seinem Bruder.
Mose	Mos	1	34	8	 Da starb Debora, der Rebekka Amme, und ward begraben unterhalb Beth-El unter der Eiche; die ward genannt die Klageeiche.
Mose	Mos	1	34	9	 Und Gott erschien Jakob abermals, nachdem er aus Mesopotamien gekommen war, und segnete ihn
Mose	Mos	1	34	10	 und sprach zu ihm: Du heißt Jakob; aber du sollst nicht mehr Jakob heißen, sondern Israel sollst du heißen. Und also heißt man ihn Israel.
Mose	Mos	1	34	11	 Und Gott sprach zu ihm: Ich bin der allmächtige Gott; sei fruchtbar und mehre dich; Völker und Völkerhaufen sollen von dir kommen, und Könige sollen aus deinen Lenden kommen;
Mose	Mos	1	34	12	 und das Land, das ich Abraham und Isaak gegeben habe, will ich dir geben und will's deinem Samen nach dir geben.
Mose	Mos	1	34	13	 Also fuhr Gott auf von ihm von dem Ort, da er mit ihm geredet hatte.
Mose	Mos	1	34	14	 Jakob aber richtete ein steinernes Mal auf an dem Ort, da er mit ihm geredet hatte, und goß ein Trankopfer darauf und begoß es mit Öl.
Mose	Mos	1	34	15	 Und Jakob hieß den Ort, da Gott mit ihm geredet hatte, Beth-El.
Mose	Mos	1	34	16	 Und sie zogen von Beth-El. Und da noch ein Feld Weges war von Ephrath, da gebar Rahel.
Mose	Mos	1	34	17	 Und es kam sie hart an über der Geburt. Da aber die Geburt so schwer ward, sprach die Wehmutter zu ihr: Fürchte dich nicht, denn diesen Sohn wirst du auch haben.
Mose	Mos	1	34	18	 Da ihr aber die Seele ausging, daß sie sterben mußte, hieß sie ihn Ben-Oni; aber sein Vater hieß ihn Ben-Jamin.
Mose	Mos	1	34	19	 Also starb Rahel und ward begraben an dem Wege gen Ephrath, das nun heißt Bethlehem.
Mose	Mos	1	34	20	 Und Jakob richtete ein Mal auf über ihrem Grabe; dasselbe ist das Grabmal Rahels bis auf diesen Tag.
Mose	Mos	1	34	21	 Und Israel zog aus und richtete seine Hütte auf jenseit des Turms Eder.
Mose	Mos	1	34	22	 Und es begab sich, da Israel im Lande wohnte, ging Ruben hin und schlief bei Bilha, seines Vaters Kebsweib; und das kam vor Israel. Es hatte aber Jakob zwölf Söhne.
Mose	Mos	1	34	23	 Die Söhne Leas waren diese: Ruben, der erstgeborene Sohn Jakobs, Simeon, Levi, Juda, Isaschar und Sebulon;
Mose	Mos	1	34	24	 die Söhne Rahel waren: Joseph und Benjamin;
Mose	Mos	1	34	25	 die Söhne Bilhas, Rahels Magd: Dan und Naphthali;
Mose	Mos	1	34	26	 die Söhne Silpas, Leas Magd: Gad und Asser. Das sind die Söhne Jakobs, die ihm geboren sind in Mesopotamien.
Mose	Mos	1	34	27	 Und Jakob kam zu seinem Vater Isaak gen Mamre zu Kirjat-Arba, das da heißt Hebron, darin Abraham und Isaak Fremdlinge gewesen sind.
Mose	Mos	1	34	28	 Und Isaak ward hundertundachtzig Jahre alt
Mose	Mos	1	34	29	 und nahm ab und starb und ward versammelt zu seinem Volk, alt und des Lebens satt. Und seine Söhne Esau und Jakob begruben ihn.
Mose	Mos	1	35	1 	 Das ist das Geschlecht Esaus, der da heißt Edom.
Mose	Mos	1	35	2	 Esau nahm Weiber von den Töchtern Kanaans: Ada, die Tochter Elons, des Hethiters, und Oholibama, die Tochter des Ana, die Enkelin des Zibeons, des Heviters,
Mose	Mos	1	35	3	 und Basmath, Ismaels Tochter, Nebajoths Schwester.
Mose	Mos	1	35	4	 Und Ada gebar dem Esau Eliphas, aber Basmath gebar Reguel.
Mose	Mos	1	35	5	 Oholibama gebar Jehus, Jaelam und Korah. Das sind Esaus Kinder, die ihm geboren sind im Lande Kanaan.
Mose	Mos	1	35	6	 Und Esau nahm seine Weiber, Söhne und Töchter und alle Seelen seines Hauses, seine Habe und alles Vieh mit allen Gütern, so er im Lande Kanaan erworben hatte, und zog in ein ander Land, hinweg von seinem Bruder Jakob.
Mose	Mos	1	35	7	 Denn ihre Habe war zu groß, daß sie nicht konnten beieinander wohnen; und das Land darin sie Fremdlinge waren, vermochte sie nicht zu ertragen vor der Menge ihres Viehs.
Mose	Mos	1	35	8	 Also wohnte Esau auf dem Gebirge Seir. Und Esau ist der Edom.
Mose	Mos	1	35	9	 Dies ist das Geschlecht Esaus, von dem die Edomiter herkommen, auf dem Gebirge Seir.
Mose	Mos	1	35	10	 Und so heißen die Kinder Esaus: Eliphas, der Sohn Adas, Esaus Weibes; Reguel, der Sohn Basmaths, Esaus Weibes.
Mose	Mos	1	35	11	 Des Eliphas Söhne aber waren diese: Theman, Omar, Zepho, Gaetham und Kenas.
Mose	Mos	1	35	12	 Und Thimna war ein Kebsweib des Eliphas, Esaus Sohnes; die gebar ihm Amalek. Das sind die Kinder von Ada, Esaus Weib.
Mose	Mos	1	35	13	 Die Kinder aber Reguels sind diese: Nahath, Serah, Samma, Missa. Das sind die Kinder von Basmath, Esaus Weib.
Mose	Mos	1	35	14	 Die Kinder aber von Oholibama, Esaus Weib, der Tochter des Ana, der Enkelin Zibeons, sind diese, die sie dem Esau gebar: Jehus, Jaelam und Korah.
Mose	Mos	1	35	15	 Das sind die Fürsten unter den Kindern Esaus. Die Kinder des Eliphas, des ersten Sohnes Esaus: der Fürst Theman, der Fürst Omar, der Fürst Zepho, der Fürst Kenas,
Mose	Mos	1	35	16	 der Fürst Korah, der Fürst Gaetham, der Fürst Amalek. Das sind die Fürsten von Eliphas im Lande Edom und sind Kinder der Ada.
Mose	Mos	1	35	17	 Und das sind die Kinder Reguels, Esaus Sohnes: der Fürst Nahath, der Fürst Serah, der Fürst Samma, der Fürst Missa. Das sind die Fürsten von Reguel im Lande der Edomiter und sind Kinder von der Basmath, Esaus Weib.
Mose	Mos	1	35	18	 Das sind die Kinder Oholibamas, Esaus Weibes: der Fürst Jehus, der Fürst Jaelam, der Fürst Korah. Das sind die Fürsten von Oholibama, der Tochter des Ana, Esaus Weib.
Mose	Mos	1	35	19	 Das sind die Kinder und ihre Fürsten. Er ist der Edom.
Mose	Mos	1	35	20	 Die Kinder aber von Seir, dem Horiter, die im Lande wohnten, sind diese: Lotan, Sobal, Zibeon, Ana, Dison, Ezer und Disan.
Mose	Mos	1	35	21	 Das sind die Fürsten der Horiter, Kinder des Seir, im Lande Edom.
Mose	Mos	1	35	22	 Aber des Lotan Kinder waren diese: Hori, Heman; und Lotans Schwester hieß Thimna.
Mose	Mos	1	35	23	 Die Kinder von Sobal waren diese: Alwan, Manahath, Ebal, Sepho und Onam.
Mose	Mos	1	35	24	 Die Kinder von Zibeon waren diese: Aja und Ana. Das ist der Ana, der in der Wüste die warmen Quellen fand, da er seines Vaters Zibeon Esel hütete.
Mose	Mos	1	35	25	 Die Kinder aber Anas waren: Dison und Oholibama, das ist die Tochter Anas.
Mose	Mos	1	35	26	 Die Kinder Disons waren: Hemdan, Esban, Jethran und Cheran.
Mose	Mos	1	35	27	 Die Kinder Ezers waren: Bilhan, Sawan und Akan.
Mose	Mos	1	35	28	 Die Kinder Disans waren: Uz und Aran.
Mose	Mos	1	35	29	 Dies sind die Fürsten der Horiter: der Fürst Lotan, der Fürst Sobal, der Fürst Zibeon, der Fürst Ana,
Mose	Mos	1	35	30	 der Fürst Dison, der Fürst Ezer, der Fürst Disan. Das sind die Fürsten der Horiter, die regiert haben im Lande Seir.
Mose	Mos	1	35	31	 Die Könige aber, die im Lande Edom regiert haben, ehe denn die Kinder Israel Könige hatten, sind diese:
Mose	Mos	1	35	32	 Bela war König in Edom, ein Sohn Beors, und seine Stadt hieß Dinhaba.
Mose	Mos	1	35	33	 Und da Bela starb, ward König an seiner Statt Jobab, ein Sohn Serahs von Bozra.
Mose	Mos	1	35	34	 Da Jobab starb, ward an seiner Statt König Husam aus der Themaniter Lande.
Mose	Mos	1	35	35	 Da Husam starb, ward König an seiner Statt Hadad, ein Sohn Bedads, der die Midianiter schlug auf der Moabiter Felde; und seine Stadt hieß Awith.
Mose	Mos	1	35	36	 Da Hadad starb, regierte Samla von Masrek.
Mose	Mos	1	35	37	 Da Samla starb, ward Saul König, von Rehoboth am Strom.
Mose	Mos	1	35	38	 Da Saul starb, ward an seiner Statt König Baal-Hanan, der Sohn Achbors.
Mose	Mos	1	35	39	 Da Baal-Hanan, Achbors Sohn, starb, ward an seiner Statt König Hadar; und seine Stadt hieß Pagu, und sein Weib Mehetabeel, eine Tochter Matreds, die Mesahabs Tochter war.
Mose	Mos	1	35	40	 Also heißen die Fürsten von Esau in ihren Geschlechtern, Örtern und Namen: der Fürst Thimna, der Fürst Alwa, der Fürst Jetheth,
Mose	Mos	1	35	41	 der Fürst Oholibama, der Fürst Ela, der Fürst Pinon,
Mose	Mos	1	35	42	 der Fürst Kenas, der Fürst Theman, der Fürst Mibzar,
Mose	Mos	1	35	43	 der Fürst Magdiel, der Fürst Iram. Das sind die Fürsten in Edom, wie sie gewohnt haben in ihrem Erblande. Das ist Esau, der Vater der Edomiter.
Mose	Mos	1	36	1 	 Jakob aber wohnte im Lande, darin sein Vater ein Fremdling gewesen war, im Lande Kanaan.
Mose	Mos	1	36	2	 Und dies sind die Geschlechter Jakobs: Joseph war siebzehn Jahre alt, da er ein Hirte des Viehs ward mit seinen Brüdern; und der Knabe war bei den Kinder Bilhas und Silpas, der Weiber seines Vaters, und brachte vor ihren Vater, wo ein böses Geschrei wider sie war.
Mose	Mos	1	36	3	 Israel aber hatte Joseph lieber als alle seine Kinder, darum daß er ihn im Alter gezeugt hatte; und machte ihm einen bunten Rock.
Mose	Mos	1	36	4	 Da nun seine Brüder sahen, daß ihn ihr Vater lieber hatte als alle seine Brüder, waren sie ihm feind und konnten ihm kein freundlich Wort zusprechen.
Mose	Mos	1	36	5	 Dazu hatte Joseph einmal einen Traum und sagte zu seinen Brüdern davon; da wurden sie ihm noch feinder.
Mose	Mos	1	36	6	 Denn er sprach zu ihnen: Höret doch, was mir geträumt hat:
Mose	Mos	1	36	7	 Mich deuchte, wir banden Garben auf dem Felde, und meine Garbe richtete sich auf und stand, und eure Garben umher neigten sich vor meiner Garbe.
Mose	Mos	1	36	8	 Da sprachen seine Brüder zu ihm: Solltest du unser König werden und über uns herrschen? und sie wurden ihm noch feinder um seines Traumes und seiner Rede willen.
