Mose	Mos	2	8	22 	Mose sprach: Das geht nicht an, denn was wir dem HERRN, unserm Gott, opfern, ist den Ägyptern ein Greuel. Siehe, wenn wir vor ihren Augen opfern, was ihnen ein Greuel ist, werden sie uns dann nicht steinigen?
Mose	Mos	2	8	23 	Drei Tagereisen weit wollen wir in die Wüste ziehen und dem HERRN, unserm Gott, opfern, wie er uns gesagt hat.
Mose	Mos	2	8	24 	Der Pharao sprach: Ich will euch ziehen lassen, daß ihr dem HERRN, eurem Gott, opfert in der Wüste. Nur zieht nicht zu weit, und bittet für mich!
Mose	Mos	2	8	25 	Mose sprach: Siehe, wenn ich jetzt von dir hinausgegangen bin, so will ich den HERRN bitten, daß die Stechfliegen morgen vom Pharao und seinen Großen und seinem Volk weichen; nur täusche uns nicht abermals, daß du das Volk nicht ziehen läßt, dem HERRN zu opfern.
Mose	Mos	2	8	26 	Und Mose ging hinaus vom Pharao und bat den HERRN.
Mose	Mos	2	8	27 	Und der HERR tat, wie Mose gesagt hatte, und schaffte die Stechfliegen weg vom Pharao, von seinen Großen und von seinem Volk, so daß auch nicht eine übrigblieb.
Mose	Mos	2	8	28 	Aber der Pharao verhärtete sein Herz auch diesmal und ließ das Volk nicht ziehen.
Mose	Mos	2	9	1 	Da sprach der HERR zu Mose: Geh hin zum Pharao und sage zu ihm: So spricht der HERR, der Gott der Hebräer: Laß mein Volk ziehen, daß sie mir dienen!
Mose	Mos	2	9	2 	Wenn du dich weigerst und sie weiter aufhältst,
Mose	Mos	2	9	3 	siehe, so wird die Hand des HERRN kommen über dein Vieh auf dem Felde, über die Pferde, Esel, Kamele, Rinder und Schafe, mit sehr schwerer Pest.
Mose	Mos	2	9	4 	Aber der HERR wird einen Unterschied machen zwischen dem Vieh der Israeliten und dem der Ägypter, daß nichts sterbe von allem, was die Kinder Israel haben.
Mose	Mos	2	9	5 	Und der HERR bestimmte eine Zeit und sprach: Morgen wird der HERR solches an dem Lande tun.
Mose	Mos	2	9	6 	Und der HERR tat es am andern Morgen; da starb alles Vieh der Ägypter, aber von dem Vieh der Kinder Israel starb nicht eins.
Mose	Mos	2	9	7 	Und der Pharao sandte hin, und siehe, es war von dem Vieh Israels nicht eins gestorben. Aber das Herz des Pharao wurde verstockt, und er ließ das Volk nicht ziehen.
Mose	Mos	2	9	8 	Da sprach der HERR zu Mose und Aaron: Füllt eure Hände mit Ruß aus dem Ofen, und Mose werfe ihn vor dem Pharao gen Himmel,
Mose	Mos	2	9	9 	daß er über ganz Ägyptenland staube und böse Blattern aufbrechen an den Menschen und am Vieh in ganz Ägyptenland.
Mose	Mos	2	9	10 	Und sie nahmen Ruß aus dem Ofen und traten vor den Pharao, und Mose warf den Ruß gen Himmel. Da brachen auf böse Blattern an den Menschen und am Vieh,
Mose	Mos	2	9	11 	so daß die Zauberer nicht vor Mose treten konnten wegen der bösen Blattern; denn es waren an den Zauberern ebenso böse Blattern wie an allen Ägyptern.
Mose	Mos	2	9	12 	Aber der HERR verstockte das Herz des Pharao, daß er nicht auf sie hörte, wie denn der HERR zu Mose gesagt hatte.
Mose	Mos	2	9	13 	Da sprach der HERR zu Mose: Mach dich morgen früh auf und tritt vor den Pharao und sage zu ihm: So spricht der HERR, der Gott der Hebräer: Laß mein Volk ziehen, daß es mir diene;
Mose	Mos	2	9	14 	sonst werde ich diesmal alle meine Plagen über dich selbst senden, über deine Großen und über dein Volk, damit du innewirst, daß meinesgleichen nicht ist in allen Landen.
Mose	Mos	2	9	15 	Denn ich hätte schon meine Hand ausrecken und dich und dein Volk mit Pest schlagen können, daß du von der Erde vertilgt würdest,
Mose	Mos	2	9	16 	aber dazu habe ich dich erhalten, daß meine Kraft an dir erscheine und mein Name verkündigt werde in allen Landen.
Mose	Mos	2	9	17 	Du stellst dich noch immer wider mein Volk und willst es nicht ziehen lassen.
Mose	Mos	2	9	18 	Siehe, ich will morgen um diese Zeit einen sehr großen Hagel fallen lassen, wie er noch nie in Ägypten gewesen ist von der Zeit an, als es gegründet wurde, bis heute.
Mose	Mos	2	9	19 	Und nun sende hin und verwahre dein Vieh und alles, was du auf dem Felde hast. Denn alle Menschen und das Vieh, alles, was auf dem Felde gefunden und nicht in die Häuser gebracht wird, muß sterben, wenn der Hagel auf sie fällt.
Mose	Mos	2	9	20 	Wer nun von den Großen des Pharao das Wort des HERRN fürchtete, der ließ seine Knechte und sein Vieh in die Häuser fliehen.
Mose	Mos	2	9	21 	Wessen Herz sich aber nicht an des HERRN Wort kehrte, der ließ seine Knechte und sein Vieh auf dem Felde.
Mose	Mos	2	9	22 	Da sprach der HERR zu Mose: Recke deine Hand aus gen Himmel, daß es hagelt über ganz Ägyptenland, über Menschen, über Vieh und über alles Gewächs auf dem Felde in Ägyptenland.
Mose	Mos	2	9	23 	Da streckte Mose seinen Stab gen Himmel, und der HERR ließ donnern und hageln, und Feuer schoß auf die Erde nieder. So ließ der HERR Hagel fallen über Ägyptenland,
Mose	Mos	2	9	24 	und Blitze zuckten dazwischen, und der Hagel war so schwer, wie er noch nie in ganz Ägyptenland gewesen war, seitdem Leute dort wohnen.
Mose	Mos	2	9	25 	Und der Hagel erschlug in ganz Ägyptenland alles, was auf dem Felde war, Menschen und Vieh, und zerschlug alles Gewächs auf dem Felde und zerbrach alle Bäume auf dem Felde.
Mose	Mos	2	9	26 	Nur im Lande Gosen, wo die Kinder Israel waren, da hagelte es nicht.
Mose	Mos	2	9	27 	Da schickte der Pharao hin und ließ Mose und Aaron rufen und sprach zu ihnen: Diesmal hab ich mich versündigt; der HERR ist im Recht, ich aber und mein Volk sind schuldig.
Mose	Mos	2	9	28 	Bittet aber den HERRN, daß er ein Ende mache mit diesem Donnern und Hageln, so will ich euch ziehen lassen, daß ihr nicht länger hier bleiben müßt.
Mose	Mos	2	9	29 	Mose sprach zu ihm: Wenn ich zur Stadt hinauskomme, will ich meine Hände ausbreiten zum HERRN, so wird der Donner aufhören und kein Hagel mehr fallen, damit du innewirst, daß die Erde des HERRN ist.
Mose	Mos	2	9	30 	Ich weiß aber: Du und deine Großen, ihr fürchtet euch noch nicht vor Gott dem HERRN.
Mose	Mos	2	9	31 	So wurden zerschlagen der Flachs und die Gerste, denn die Gerste stand in Ähren und der Flachs in Blüte.
Mose	Mos	2	9	32 	Aber der Weizen und das Korn wurden nicht zerschlagen, denn es ist Spätgetreide.
Mose	Mos	2	9	33 	So ging nun Mose von dem Pharao zur Stadt hinaus und breitete seine Hände aus zum HERRN, und Donner und Hagel hörten auf, und der Regen troff nicht mehr auf die Erde.
Mose	Mos	2	9	34 	Als aber der Pharao sah, daß Regen, Donner und Hagel aufhörten, versündigte er sich weiter und verhärtete sein Herz, er und seine Großen.
Mose	Mos	2	9	35 	So wurde des Pharao Herz verstockt, daß er die Kinder Israel nicht ziehen ließ, wie der HERR durch Mose gesagt hatte.
Mose	Mos	2	10	1 	Da sprach der HERR zu Mose: Geh hin zum Pharao; denn ich habe sein und seiner Großen Herz verhärtet, auf daß ich diese meine Zeichen unter ihnen tue
Mose	Mos	2	10	2 	und auf daß du verkündigest vor den Ohren deiner Kinder und deiner Kindeskinder, wie ich mit den Ägyptern verfahren bin und welche Zeichen ich unter ihnen getan habe, damit ihr wisset: Ich bin der HERR.
Mose	Mos	2	10	3 	So gingen Mose und Aaron hin zum Pharao und sprachen zu ihm: So spricht der HERR, der Gott der Hebräer: Wie lange weigerst du dich, dich vor mir zu demütigen? Laß mein Volk ziehen, daß es mir diene!
Mose	Mos	2	10	4 	Weigerst du dich aber, mein Volk ziehen zu lassen, siehe, so will ich morgen Heuschrecken kommen lassen über dein Gebiet,
Mose	Mos	2	10	5 	daß sie das Land so bedecken, daß man von ihm nichts mehr sehen kann. Und sie sollen fressen, was euch noch übrig und verschont geblieben ist von dem Hagel, und sollen alle Bäume kahlfressen, die wieder sprossen auf dem Felde;
Mose	Mos	2	10	6 	und sie sollen füllen deine Häuser und die Häuser deiner Großen und aller Ägypter, wie es nicht gesehen haben deine Väter und deiner Väter Väter, seit sie auf Erden waren, bis auf diesen Tag. Und er wandte sich und ging vom Pharao hinaus.
Mose	Mos	2	10	7 	Da sprachen die Großen des Pharao zu ihm: Wie lange soll dieser Mann uns Verderben bringen? Laß die Leute ziehen, daß sie dem HERR, ihrem Gott, dienen. Willst du erst erfahren, daß Ägypten untergegangen ist?
Mose	Mos	2	10	8 	Da wurden Mose und Aaron wieder vor den Pharao gebracht. Der sprach zu ihnen: Geht hin und dienet dem HERRN, eurem Gott. Wer von euch soll aber hinziehen?
Mose	Mos	2	10	9 	Mose sprach: Wir wollen ziehen mit jung und alt, mit Söhnen und Töchtern, mit Schafen und Rindern; denn wir haben ein Fest des HERRN.
Mose	Mos	2	10	10 	Er sprach zu ihnen: O ja, der HERR sei mit euch, so gewiß wie ich euch und eure Kinder ziehen lasse! Ihr seht doch selbst, daß ihr Böses vorhabt!
Mose	Mos	2	10	11 	Nein, nur ihr Männer zieht hin und dient dem HERRN! Denn das ist es doch, was ihr begehrt habt. Und man stieß sie hinaus vom Pharao.
Mose	Mos	2	10	12 	Da sprach der HERR zu Mose: Recke deine Hand über Ägyptenland, daß Heuschrecken auf Ägyptenland kommen und alles auffressen, was im Lande wächst, alles, was der Hagel übriggelassen hat.
Mose	Mos	2	10	13 	Mose streckte seinen Stab über Ägyptenland, und der HERR trieb einen Ostwind ins Land, den ganzen Tag und die ganze Nacht. Und am Morgen führte der Ostwind die Heuschrecken herbei.
Mose	Mos	2	10	14 	Und sie kamen über ganz Ägyptenland und ließen sich nieder überall in Ägypten, so viele, wie nie zuvor gewesen sind noch hinfort sein werden.
Mose	Mos	2	10	15 	Denn sie bedeckten den Erdboden so dicht, daß er ganz dunkel wurde. Und sie fraßen alles, was im Lande wuchs, und alle Früchte auf den Bäumen, die der Hagel übriggelassen hatte, und ließen nichts Grünes übrig an den Bäumen und auf dem Felde in ganz Ägyptenland.
Mose	Mos	2	10	16 	Da ließ der Pharao eilends Mose und Aaron rufen und sprach: Ich habe mich versündigt an dem HERRN, eurem Gott, und an euch.
Mose	Mos	2	10	17 	Vergebt mir meine Sünde nur noch diesmal und bittet den HERRN, euren Gott, daß er doch diesen Tod von mir wegnehme.
Mose	Mos	2	10	18 	Und Mose ging hinaus vom Pharao und betete zum HERRN.
Mose	Mos	2	10	19 	Da wendete der HERR den Wind, so daß er sehr stark aus Westen kam; der hob die Heuschrecken auf und warf sie ins Schilfmeer, daß nicht eine übrigblieb in ganz Ägypten.
Mose	Mos	2	10	20 	Aber der HERR verstockte das Herz des Pharao, daß er die Kinder Israel nicht ziehen ließ.
Mose	Mos	2	10	21 	Da sprach der HERR zu Mose: Recke deine Hand gen Himmel, daß eine solche Finsternis werde in Ägyptenland, daß man sie greifen kann.
Mose	Mos	2	10	22 	Und Mose reckte seine Hand gen Himmel. Da ward eine so dicke Finsternis in ganz Ägyptenland drei Tage lang,
Mose	Mos	2	10	23 	daß niemand den andern sah noch weggehen konnte von dem Ort, wo er gerade war, drei Tage lang. Aber bei allen Kindern Israel war es licht in ihren Wohnungen.
Mose	Mos	2	10	24 	Da rief der Pharao nach Mose und sprach: Zieht hin und dienet dem HERRN! Nur eure Schafe und Rinder laßt hier; aber eure Frauen und Kinder dürfen mit euch ziehen.
Mose	Mos	2	10	25 	Mose sprach: Willst du uns denn Schlachtopfer und Brandopfer mitgeben, die wir unserm Gott, dem HERRN, darbringen?
Mose	Mos	2	10	26 	Auch unser Vieh soll mit uns gehen – nicht eine Klaue darf dahintenbleiben -; denn davon müssen wir nehmen zum Dienst unseres Gottes, des HERRN. Wir wissen nicht, womit wir dem HERRN dienen sollen, bis wir dorthin kommen.
Mose	Mos	2	10	27 	Aber der HERR verstockte das Herz des Pharao, daß er sie nicht ziehen lassen wollte.
Mose	Mos	2	10	28 	Und der Pharao sprach zu ihm: Geh von mir und hüte dich, daß du mir nicht mehr vor die Augen kommst; denn an dem Tage, da du mir vor die Augen kommst, sollst du sterben.
Mose	Mos	2	10	29 	Mose antwortete: Wie du gesagt hast; ich werde dir nicht mehr vor die Augen kommen.
Mose	Mos	2	11	1 	Und der HERR sprach zu Mose: Eine Plage noch will ich über den Pharao und Ägypten kommen lassen. Dann wird er euch von hier wegziehen lassen, und nicht nur das, sondern er wird euch von hier sogar vertreiben.
Mose	Mos	2	11	2 	So sage nun zu dem Volk, daß ein jeder sich von seinem Nachbarn und eine jede von ihrer Nachbarin silbernes und goldenes Geschmeide geben lasse.
Mose	Mos	2	11	3 	Und der HERR verschaffte dem Volk Gunst bei den Ägyptern, und Mose war ein sehr angesehener Mann in Ägyptenland vor den Großen des Pharao und vor dem Volk.
Mose	Mos	2	11	4 	Und Mose sprach: So spricht der HERR: Um Mitternacht will ich durch Ägyptenland gehen,
Mose	Mos	2	11	5 	und alle Erstgeburt in Ägyptenland soll sterben, vom ersten Sohn des Pharao an, der auf seinem Thron sitzt, bis zum ersten Sohn der Magd, die hinter ihrer Mühle hockt, und alle Erstgeburt unter dem Vieh.
Mose	Mos	2	11	6 	Und es wird ein großes Geschrei sein in ganz Ägyptenland, wie nie zuvor gewesen ist noch werden wird;
Mose	Mos	2	11	7 	aber gegen ganz Israel soll nicht ein Hund mucken, weder gegen Mensch noch Vieh, auf daß ihr erkennt, daß der HERR einen Unterschied macht zwischen Ägypten und Israel.
Mose	Mos	2	11	8 	Dann werden zu mir herabkommen alle diese deine Großen und mir zu Füßen fallen und sagen: Zieh aus, du und alles Volk, das dir nachgeht. Und daraufhin werde ich ausziehen.
Mose	Mos	2	11	9 	Der HERR aber sprach zu Mose: Der Pharao wird nicht auf euch hören, auf daß meiner Wunder noch mehr werden in Ägyptenland.
Mose	Mos	2	11	10 	Und Mose und Aaron haben diese Wunder alle getan vor dem Pharao; aber der HERR verstockte ihm das Herz, so daß er die Kinder Israel nicht ziehen ließ aus seinem Lande.
Mose	Mos	2	12	1 	Der HERR aber sprach zu Mose und Aaron in Ägyptenland:
Mose	Mos	2	12	2 	Dieser Monat soll bei euch der erste Monat sein, und von ihm an sollt ihr die Monate des Jahres zählen.
Mose	Mos	2	12	3 	Sagt der ganzen Gemeinde Israel: Am zehnten Tage dieses Monats nehme jeder Hausvater ein Lamm, je ein Lamm für ein Haus.
Mose	Mos	2	12	4 	Wenn aber in einem Hause für ein Lamm zu wenige sind, so nehme er's mit seinem Nachbarn, der seinem Hause am nächsten wohnt, bis es so viele sind, daß sie das Lamm aufessen können.
Mose	Mos	2	12	5 	Ihr sollt aber ein solches Lamm nehmen, an dem kein Fehler ist, ein männliches Tier, ein Jahr alt. Von den Schafen und Ziegen sollt ihr's nehmen
Mose	Mos	2	12	6 	und sollt es verwahren bis zum vierzehnten Tag des Monats. Da soll es die ganze Gemeinde Israel schlachten gegen Abend.
Mose	Mos	2	12	7 	Und sie sollen von seinem Blut nehmen und beide Pfosten an der Tür und die obere Schwelle damit bestreichen an den Häusern, in denen sie's essen,
Mose	Mos	2	12	8 	und sollen das Fleisch essen in derselben Nacht, am Feuer gebraten, und ungesäuertes Brot dazu und sollen es mit bitteren Kräutern essen.
Mose	Mos	2	12	9 	Ihr sollt es weder roh essen noch mit Wasser gekocht, sondern am Feuer gebraten mit Kopf, Schenkeln und inneren Teilen.
Mose	Mos	2	12	10 	Und ihr sollt nichts davon übriglassen bis zum Morgen; wenn aber etwas übrigbleibt bis zum Morgen, sollt ihr's mit Feuer verbrennen.
Mose	Mos	2	12	11 	So sollt ihr's aber essen: Um eure Lenden sollt ihr gegürtet sein und eure Schuhe an euren Füßen haben und den Stab in der Hand und sollt es essen als die, die hinwegeilen; es ist des HERRN Passa.
Mose	Mos	2	12	12 	Denn ich will in derselben Nacht durch Ägyptenland gehen und alle Erstgeburt schlagen in Ägyptenland unter Mensch und Vieh und will Strafgericht halten über alle Götter der Ägypter, ich, der HERR.
Mose	Mos	2	12	13 	Dann aber soll das Blut euer Zeichen sein an den Häusern, in denen ihr seid: Wo ich das Blut sehe, will ich an euch vorübergehen, und die Plage soll euch nicht widerfahren, die das Verderben bringt, wenn ich Ägyptenland schlage.
Mose	Mos	2	12	14 	Ihr sollt diesen Tag als Gedenktag haben und sollt ihn feiern als ein Fest für den HERRN, ihr und alle eure Nachkommen, als ewige Ordnung.
Mose	Mos	2	12	15 	Sieben Tage sollt ihr ungesäuertes Brot essen. Schon am ersten Tag sollt ihr den Sauerteig aus euren Häusern tun. Wer gesäuertes Brot ißt, vom ersten Tag an bis zum siebenten, der soll ausgerottet werden aus Israel.
Mose	Mos	2	12	16 	Am ersten Tag soll heilige Versammlung sein, und am siebenten soll auch heilige Versammlung sein. Keine Arbeit sollt ihr dann tun; nur was jeder zur Speise braucht, das allein dürft ihr euch zubereiten.
Mose	Mos	2	12	17 	Haltet das Gebot der ungesäuerten Brote. Denn eben an diesem Tage habe ich eure Scharen aus Ägyptenland geführt; darum sollt ihr diesen Tag halten, ihr und alle eure Nachkommen, als ewige Ordnung.
Mose	Mos	2	12	18 	Am vierzehnten Tage des ersten Monats am Abend sollt ihr ungesäuertes Brot essen bis zum Abend des einundzwanzigsten Tages des Monats,
Mose	Mos	2	12	19 	so daß man sieben Tage lang keinen Sauerteig finde in euren Häusern. Denn wer gesäuertes Brot ißt, der soll ausgerottet werden aus der Gemeinde Israel, auch ein Fremdling oder ein Einheimischer des Landes.
Mose	Mos	2	12	20 	Keinerlei gesäuertes Brot sollt ihr essen, sondern nur ungesäuertes Brot, wo immer ihr wohnt.
Mose	Mos	2	12	21 	Und Mose berief alle Ältesten Israels und sprach zu ihnen: Leset Schafe aus und nehmt sie für euch nach euren Geschlechtern und schlachtet das Passa.
Mose	Mos	2	12	22 	Und nehmt ein Büschel Ysop und taucht es in das Blut in dem Becken und bestreicht damit die Oberschwelle und die beiden Pfosten. Und kein Mensch gehe zu seiner Haustür heraus bis zum Morgen.
Mose	Mos	2	12	23 	Denn der HERR wird umhergehen und die Ägypter schlagen. Wenn er aber das Blut sehen wird an der Oberschwelle und an den beiden Pfosten, wird er an der Tür vorübergehen und den Verderber nicht in eure Häuser kommen lassen, um euch zu schlagen.
Mose	Mos	2	12	24 	Darum so halte diese Ordnung für dich und deine Nachkommen ewiglich.
Mose	Mos	2	12	25 	Und wenn ihr in das Land kommt, das euch der HERR geben wird, wie er gesagt hat, so haltet diesen Brauch.
Mose	Mos	2	12	26 	Und wenn eure Kinder zu euch sagen werden: Was habt ihr da für einen Brauch?,
Mose	Mos	2	12	27 	sollt ihr sagen: Es ist das Passaopfer des HERRN, der an den Kindern Israel vorüberging in Ägypten, als er die Ägypter schlug und unsere Häuser errettete. Da neigte sich das Volk und betete an.
Mose	Mos	2	12	28 	Und die Kinder Israel gingen hin und taten, wie der HERR es Mose und Aaron geboten hatte.
Mose	Mos	2	12	29 	Und zur Mitternacht schlug der HERR alle Erstgeburt in Ägyptenland vom ersten Sohn des Pharao an, der auf seinem Thron saß, bis zum ersten Sohn des Gefangenen im Gefängnis und alle Erstgeburt des Viehs.
Mose	Mos	2	12	30 	Da stand der Pharao auf in derselben Nacht und alle seine Großen und alle Ägypter, und es ward ein großes Geschrei in Ägypten; denn es war kein Haus, in dem nicht ein Toter war.
Mose	Mos	2	12	31 	Und er ließ Mose und Aaron rufen in der Nacht und sprach: Macht euch auf und ziehet weg aus meinem Volk, ihr und die Kinder Israel. Geht hin und dienet dem HERRN, wie ihr gesagt habt.
Mose	Mos	2	12	32 	Nehmt auch mit euch eure Schafe und Rinder, wie ihr gesagt habt. Geht hin und bittet auch um Segen für mich.
Mose	Mos	2	12	33 	Und die Ägypter drängten das Volk und trieben es eilends aus dem Lande; denn sie sprachen: Wir sind alle des Todes.
Mose	Mos	2	12	34 	Und das Volk trug den rohen Teig, ehe er durchsäuert war, ihre Backschüsseln in ihre Mäntel gewickelt, auf ihren Schultern.
Mose	Mos	2	12	35 	Und die Kinder Israel hatten getan, wie Mose gesagt hatte, und hatten sich von den Ägyptern silbernes und goldenes Geschmeide und Kleider geben lassen.
Mose	Mos	2	12	36 	Dazu hatte der HERR dem Volk Gunst verschafft bei den Ägyptern, daß sie ihnen willfährig waren, und so nahmen sie es von den Ägyptern zur Beute.
Mose	Mos	2	12	37 	Also zogen die Kinder Israel aus von Ramses nach Sukkoth, sechshunderttausend Mann zu Fuß ohne die Frauen und Kinder.
Mose	Mos	2	12	38 	Und es zog auch mit ihnen viel fremdes Volk, dazu Schafe und Rinder, sehr viel Vieh.
Mose	Mos	2	12	39 	Und sie backten aus dem rohen Teig, den sie aus Ägypten mitbrachten, ungesäuerte Brote; denn er war nicht gesäuert, weil sie aus Ägypten weggetrieben wurden und sich nicht länger aufhalten konnten und keine Wegzehrung zubereitet hatten.
Mose	Mos	2	12	40 	Die Zeit aber, die die Kinder Israel in Ägypten gewohnt haben, ist vierhundertunddreißig Jahre.
Mose	Mos	2	12	41 	Als diese um waren, an eben diesem Tage zog das ganze Heer des HERRN aus Ägyptenland.
Mose	Mos	2	12	42 	Eine Nacht des Wachens war dies für den HERRN, um sie aus Ägyptenland zu führen; darum sollen die Kinder Israel diese Nacht dem HERRN zu Ehren wachen, sie und ihre Nachkommen.
Mose	Mos	2	12	43 	Und der HERR sprach zu Mose und Aaron: Dies ist die Ordnung für das Passa: Kein Ausländer soll davon essen.
Mose	Mos	2	12	44 	Ist er ein gekaufter Sklave, so beschneide man ihn; dann darf er davon essen.
Mose	Mos	2	12	45 	Ist er aber ein Beisasse oder Tagelöhner, so darf er nicht davon essen.
Mose	Mos	2	12	46 	In einem Hause soll man es verzehren; ihr sollt nichts von seinem Fleisch hinaus vor das Haus tragen und sollt keinen Knochen an ihm zerbrechen.
Mose	Mos	2	12	47 	Die ganze Gemeinde Israel soll das tun.
Mose	Mos	2	12	48 	Wenn ein Fremdling bei dir wohnt und dem HERRN das Passa halten will, der beschneide alles, was männlich ist; alsdann trete er herzu, daß er es halte, und er sei wie ein Einheimischer des Landes. Aber ein Unbeschnittener darf nicht davon essen.
Mose	Mos	2	12	49 	Ein und dasselbe Gesetz gelte für den Einheimischen und den Fremdling, der unter euch wohnt.
Mose	Mos	2	12	50 	Und alle Kinder Israel taten, wie der HERR es Mose und Aaron geboten hatte.
Mose	Mos	2	12	51 	An eben diesem Tage führte der HERR die Kinder Israel aus Ägyptenland, Schar um Schar.
Mose	Mos	2	13	1 	Und der HERR redete mit Mose und sprach:
Mose	Mos	2	13	2 	Heilige mir alle Erstgeburt bei den Kindern Israel; alles, was zuerst den Mutterschoß durchbricht bei Mensch und Vieh, das ist mein.
Mose	Mos	2	13	3 	Da sprach Mose zum Volk: Gedenket an diesen Tag, an dem ihr aus Ägypten, aus der Knechtschaft, gezogen seid, denn der HERR hat euch mit mächtiger Hand von dort herausgeführt; darum sollst du nicht gesäuertes Brot essen.
Mose	Mos	2	13	4 	Heute zieht ihr aus, im Monat Abib.
Mose	Mos	2	13	5 	Wenn dich nun der HERR bringen wird in das Land der Kanaaniter, Hethiter, Amoriter, Hewiter und Jebusiter, das er dir geben wird, wie er deinen Vätern geschworen hat, ein Land, darin Milch und Honig fließt, so sollst du diesen Brauch halten in diesem Monat.
Mose	Mos	2	13	6 	Sieben Tage sollst du ungesäuertes Brot essen, und am siebenten Tage ist des HERRN Fest.
Mose	Mos	2	13	7 	Du sollst sieben Tage ungesäuertes Brot essen, daß bei dir weder Sauerteig noch gesäuertes Brot gesehen werde an allen deinen Orten.
Mose	Mos	2	13	8 	Ihr sollt euren Söhnen sagen an demselben Tage: Das halten wir um dessentwillen, was uns der HERR getan hat, als wir aus Ägypten zogen.
Mose	Mos	2	13	9 	Darum soll es dir wie ein Zeichen sein auf deiner Hand und wie ein Merkzeichen zwischen deinen Augen, damit des HERRN Gesetz in deinem Munde sei; denn der HERR hat dich mit mächtiger Hand aus Ägypten geführt.
Mose	Mos	2	13	10 	Darum halte diese Ordnung Jahr für Jahr zu ihrer Zeit.
Mose	Mos	2	13	11 	Wenn dich nun der HERR ins Land der Kanaaniter gebracht hat, wie er dir und deinen Vätern geschworen hat, und es dir gegeben hat,
Mose	Mos	2	13	12 	so sollst du dem HERRN alles aussondern, was zuerst den Mutterschoß durchbricht. Alle männliche Erstgeburt unter dem Vieh gehört dem HERRN.
Mose	Mos	2	13	13 	Die Erstgeburt vom Esel sollst du auslösen mit einem Schaf; wenn du sie aber nicht auslöst, so brich ihr das Genick. Beim Menschen aber sollst du alle Erstgeburt unter deinen Söhnen auslösen.
Mose	Mos	2	13	14 	Und wenn dich heute oder morgen dein Sohn fragen wird: Was bedeutet das?, sollst du ihm sagen: Der HERR hat uns mit mächtiger Hand aus Ägypten, aus der Knechtschaft, geführt.
Mose	Mos	2	13	15 	Denn als der Pharao hartnäckig war und uns nicht ziehen ließ, erschlug der HERR alle Erstgeburt in Ägyptenland, von der Erstgeburt des Menschen bis zur Erstgeburt des Viehs. Darum opfere ich dem HERRN alles Männliche, das zuerst den Mutterschoß durchbricht, aber die Erstgeburt meiner Söhne löse ich aus.
Mose	Mos	2	13	16 	Und das soll dir wie ein Zeichen auf deiner Hand sein und wie ein Merkzeichen zwischen deinen Augen; denn der HERR hat uns mit mächtiger Hand aus Ägypten geführt.
Mose	Mos	2	13	17 	Als nun der Pharao das Volk hatte ziehen lassen, führte sie Gott nicht den Weg durch das Land der Philister, der am nächsten war; denn Gott dachte, es könnte das Volk gereuen, wenn sie Kämpfe vor sich sähen, und sie könnten wieder nach Ägypten umkehren.
Mose	Mos	2	13	18 	Darum ließ er das Volk einen Umweg machen und führte es durch die Wüste zum Schilfmeer. Und Israel zog wohlgeordnet aus Ägyptenland.
Mose	Mos	2	13	19 	Und Mose nahm mit sich die Gebeine Josephs; denn dieser hatte den Kindern Israel einen Eid abgenommen und gesprochen: Gott wird sich gewiß euer annehmen; dann führt meine Gebeine von hier mit euch fort.
Mose	Mos	2	13	20 	So zogen sie aus von Sukkoth und lagerten sich in Etham am Rande der Wüste.
Mose	Mos	2	13	21 	Und der HERR zog vor ihnen her, am Tage in einer Wolkensäule, um sie den rechten Weg zu führen, und bei Nacht in einer Feuersäule, um ihnen zu leuchten, damit sie Tag und Nacht wandern konnten.
Mose	Mos	2	13	22 	Niemals wich die Wolkensäule von dem Volk bei Tage noch die Feuersäule bei Nacht.
Mose	Mos	2	14	1 	Und der HERR redete mit Mose und sprach:
Mose	Mos	2	14	2 	Rede zu den Kindern Israel und sprich, daß sie umkehren und sich lagern bei Pihachiroth zwischen Migdol und dem Meer, vor Baal-Zephon; diesem gegenüber sollt ihr euch lagern.
Mose	Mos	2	14	3 	Der Pharao aber wird sagen von den Kindern Israel: Sie haben sich verirrt im Lande; die Wüste hat sie eingeschlossen.
